Bolt hakkab juhtide sõidukikaarte kontrollima	https://tehnika.postimees.ee/6904963/bolt-hakkab-juhtide-soidukikaarte-kontrollima
HKScan rajab Tallinna külje alla uue logistikakeskuse	https://majandus24.postimees.ee/6904792/hkscan-rajab-tallinna-kulje-alla-uue-logistikakeskuse
Soomlaste suurtehas sai Pärnus piraka kahjumi	https://majandus24.postimees.ee/6904769/soomlaste-suurtehas-sai-parnus-piraka-kahjumi
Eesti firma kaudu tuhandeid liitreid alkoholi müünud soomlane mõisteti õigeks	https://majandus24.postimees.ee/6904740/eesti-firma-kaudu-tuhandeid-liitreid-alkoholi-muunud-soomlane-moisteti-oigeks
Tere alustas Kruuda tehtud võlgade maksmist	https://majandus24.postimees.ee/6904601/tere-alustas-kruuda-tehtud-volgade-maksmist
Sajad Balti põllumehed nõuavad Brüsselis ausat konkurentsikeskkonda	https://majandus24.postimees.ee/6904592/sajad-balti-pollumehed-nouavad-brusselis-ausat-konkurentsikeskkonda
Uus seadus keelab elektritõuksi joobes juhtimise	https://majandus24.postimees.ee/6904508/uus-seadus-keelab-elektritouksi-joobes-juhtimise
Kohus tühistas nelja inimese karistused seoses Tartu Milli maksupettusega	https://majandus24.postimees.ee/6904450/kohus-tuhistas-nelja-inimese-karistused-seoses-tartu-milli-maksupettusega
Inbanki kasum kasvas mullu 10 miljonini	https://majandus24.postimees.ee/6904432/inbanki-kasum-kasvas-mullu-10-miljonini
Aivar Pau: jagamismajanduse ämber	https://leht.postimees.ee/6904385/aivar-pau-jagamismajanduse-amber
Jaapan teatas kahest viirusesurmast laeval karantiinis olnute seas	https://maailm.postimees.ee/6904395/jaapan-teatas-kahest-viirusesurmast-laeval-karantiinis-olnute-seas
Majandusjulgeoleku konverents 2020	https://majandus24.postimees.ee/6903959/majandusjulgeoleku-konverents-2020
Olukord Peipsil: kõik teevad hirmsasti tööd, aga raha ei teeni keegi	https://leht.postimees.ee/6903528/olukord-peipsil-koik-teevad-hirmsasti-tood-aga-raha-ei-teeni-keegi
Rimi muutis kilekotid tasuliseks kriitika ja konkurentide kiuste	https://majandus24.postimees.ee/6904227/rimi-muutis-kilekotid-tasuliseks-kriitika-ja-konkurentide-kiuste
Osula tarkvarafirma vallutab Aafrika ja Ameerika	https://leht.postimees.ee/6904221/osula-tarkvarafirma-vallutab-aafrika-ja-ameerika
Saarlased unistavad taas Mõntu-Läti laevaliinist, aga laeva pole	https://majandus24.postimees.ee/6904259/saarlased-unistavad-taas-montu-lati-laevaliinist-aga-laeva-pole
Cambridge’i raport: Eestis võiks raiuda aastas kuni 12 miljonit tihumeetrit	https://majandus24.postimees.ee/6904139/cambridge-i-raport-eestis-voiks-raiuda-aastas-kuni-12-miljonit-tihumeetrit
Tormiga Iiri randa tulnud kummituslaeva omanik ilmus välja	https://maailm.postimees.ee/6904109/tormiga-iiri-randa-tulnud-kummituslaeva-omanik-ilmus-valja
Minister Karu avas Eestis enneolematu ehituse	https://majandus24.postimees.ee/6904044/minister-karu-avas-eestis-enneolematu-ehituse
Eesti politseinikud tabasid Kreekas ebaseaduslikud sisserändajad	https://www.postimees.ee/6904004/eesti-politseinikud-tabasid-kreekas-ebaseaduslikud-sisserandajad
Lasnamäel kasvavad renditööliste tõttu pinged	https://majandus24.postimees.ee/6903966/lasnamael-kasvavad-renditooliste-tottu-pinged
Eesti jäätmekäitlejad hakkavad tunnustama klaaspakendite kogujaid	https://tarbija24.postimees.ee/6903849/eesti-jaatmekaitlejad-hakkavad-tunnustama-klaaspakendite-kogujaid
Yandex.Taxi ei kavatse Eestis tegevusluba hankida	https://tehnika.postimees.ee/6903728/yandex-taxi-ei-kavatse-eestis-tegevusluba-hankida
Miks muutis Rimi õhukesed kilekotid tasuliseks?	https://tarbija24.postimees.ee/6903647/miks-muutis-rimi-ohukesed-kilekotid-tasuliseks
Ligi pooled töötajatest kaaluvad töökoha vahetust	https://tarbija24.postimees.ee/6903524/ligi-pooled-tootajatest-kaaluvad-tookoha-vahetust
Omniva hoiatus: Hiinast tellitud kaup jääb koduaresti	https://tarbija24.postimees.ee/6903517/omniva-hoiatus-hiinast-tellitud-kaup-jaab-koduaresti
Turistid jooksevad Saaremaale tormi	https://tarbija24.postimees.ee/6903492/turistid-jooksevad-saaremaale-tormi
Ootamatu: eestlane peab paneelmajade kortereid alaväärseks	https://tarbija24.postimees.ee/6903465/ootamatu-eestlane-peab-paneelmajade-kortereid-alavaarseks
Tänavu tõuseb vanaduspension keskmiselt 45 eurot	https://majandus24.postimees.ee/6903379/tanavu-touseb-vanaduspension-keskmiselt-45-eurot
Riigifirma napsas kuluka võidu	https://leht.postimees.ee/6903330/riigifirma-napsas-kuluka-voidu
Saksamaa ja Euroopa huvid käivad käsikäes	https://leht.postimees.ee/6903258/saksamaa-ja-euroopa-huvid-kaivad-kasikaes
Lääneranna vallas võib 48 inimest töö kaotada	https://majandus24.postimees.ee/6903217/laaneranna-vallas-voib-48-inimest-too-kaotada
Mitut Hollywoodi rikkaimat näitlejat läheb vaja, et saaks kokku ühe Elon Muski?	https://kinoportaal.postimees.ee/6903157/mitut-hollywoodi-rikkaimat-naitlejat-laheb-vaja-et-saaks-kokku-uhe-elon-muski
Uus seadus peaks Eesti laevanduse tuhast tõstma	https://majandus24.postimees.ee/6903089/uus-seadus-peaks-eesti-laevanduse-tuhast-tostma
Apteekrid andsid reformi tagasipöörajate vastu turmtuld	https://majandus24.postimees.ee/6903002/apteekrid-andsid-reformi-tagasipoorajate-vastu-turmtuld
Eesti puljong võitis maailma suurimal toidumessil preemia	https://tarbija24.postimees.ee/6902852/eesti-puljong-voitis-maailma-suurimal-toidumessil-preemia
Levikom süüdistab eksministrit kuriteos	https://majandus24.postimees.ee/6902853/levikom-suudistab-eksministrit-kuriteos
Eesti Energia ostis Tootsi tuulepargi kinnistu 51,5 miljoni euroga	https://majandus24.postimees.ee/6902618/eesti-energia-ostis-tootsi-tuulepargi-kinnistu-51-5-miljoni-euroga
Soome ajaloo suurim tehing kukkus läbi	https://majandus24.postimees.ee/6902764/soome-ajaloo-suurim-tehing-kukkus-labi
Rimi muutis õhukesed kilekotid tasuliseks	https://tarbija24.postimees.ee/6902746/rimi-muutis-ohukesed-kilekotid-tasuliseks
Eesti jalgrattatööstuse elustaja: kogu aeg on väike tulekahju	https://majandus24.postimees.ee/6916536/eesti-jalgrattatoostuse-elustaja-kogu-aeg-on-vaike-tulekahju
Nafta hinda ähvardab kaos: saudid plaanivad musta kulla üleujutust	https://majandus24.postimees.ee/6917424/nafta-hinda-ahvardab-kaos-saudid-plaanivad-musta-kulla-uleujutust
Eesti noormees lahendab globaalset probleemi	https://majandus24.postimees.ee/6916526/eesti-noormees-lahendab-globaalset-probleemi
AirBaltic tühistab kõik lennud Milano ja Verona suunal	https://tarbija24.postimees.ee/6917316/airbaltic-tuhistab-koik-lennud-milano-ja-verona-suunal
Hiinast tellitud pakid lähevad kõik maksu alla	https://majandus24.postimees.ee/6917007/hiinast-tellitud-pakid-lahevad-koik-maksu-alla
Jüri Mõisa vedamisel sündis Eesti suurim betoonitööstus	https://majandus24.postimees.ee/6916865/juri-moisa-vedamisel-sundis-eesti-suurim-betoonitoostus
«Paljud ettevõtjad sõidavad majanduskasvu pärituules»	https://majandus24.postimees.ee/6916883/paljud-ettevotjad-soidavad-majanduskasvu-parituules
Vaikuse müük on Eesti idufirmale üliedukas äri	https://majandus24.postimees.ee/6916457/vaikuse-muuk-on-eesti-idufirmale-uliedukas-ari
Helme ja pankade suhted sõlmes	https://majandus24.postimees.ee/6916858/helme-ja-pankade-suhted-solmes
Venemaa näitas kartellile trääsa: nafta hind kukkus järsult	https://majandus24.postimees.ee/6916518/venemaa-naitas-kartellile-traasa-nafta-hind-kukkus-jarsult
Elisa juht: Eesti elutähtsad teenused võivad töökindluse kaotada	https://majandus24.postimees.ee/6916855/elisa-juht-eesti-elutahtsad-teenused-voivad-tookindluse-kaotada
Koroona näppas Marilt raha	https://majandus24.postimees.ee/6916748/koroona-nappas-marilt-raha
Tuleviku-Eesti keskmes on vesinik	https://leht.postimees.ee/6916828/tuleviku-eesti-keskmes-on-vesinik
Amet korraldab laevaliine saarterahva tagaselja	https://leht.postimees.ee/6916781/amet-korraldab-laevaliine-saarterahva-tagaselja
Ansip: aktsiisitõusu kahju tuleks tegijatelt sisse nõuda	https://majandus24.postimees.ee/6916558/ansip-aktsiisitousu-kahju-tuleks-tegijatelt-sisse-nouda
Starbucksi kliendid said koroonaviiruse tõttu halva uudise	https://tarbija24.postimees.ee/6916589/starbucksi-kliendid-said-koroonaviiruse-tottu-halva-uudise
Koenigsegg Gemera ja teised, mida me oleks näinud Genfi autonäitusel, kui see oleks toimunud	https://leht.postimees.ee/6914276/koenigsegg-gemera-ja-teised-mida-me-oleks-nainud-genfi-autonaitusel-kui-see-oleks-toimunud
Tallinnas alanud meremess avab 2020. aasta hobimeresõiduhooaja	https://majandus24.postimees.ee/6916539/tallinnas-alanud-meremess-avab-2020-aasta-hobimeresoiduhooaja
Lennusadamas avatakse videoinstallatsioon sadamatest	https://kultuur.postimees.ee/6916513/lennusadamas-avatakse-videoinstallatsioon-sadamatest
Novatours tühistab reisid ohupiirkonda	https://tarbija24.postimees.ee/6916448/novatours-tuhistab-reisid-ohupiirkonda
Negatiivne stsenaarium: koroonaviirus võib anda korraliku hoobi Eesti majanduskasvule	https://majandus24.postimees.ee/6916397/negatiivne-stsenaarium-koroonaviirus-voib-anda-korraliku-hoobi-eesti-majanduskasvule
Tallinki suuromanik pani aktsiatesse korraliku varanduse jagu raha	https://majandus24.postimees.ee/6916281/tallinki-suuromanik-pani-aktsiatesse-korraliku-varanduse-jagu-raha
AirBaltic tühistab koroonaviiruse tõttu veel 90 lendu	https://tarbija24.postimees.ee/6916257/airbaltic-tuhistab-koroonaviiruse-tottu-veel-90-lendu
Tänavusel Meremessil on põhirõhk praktilistel veesõidukitel	https://majandus24.postimees.ee/6916184/tanavusel-meremessil-on-pohirohk-praktilistel-veesoidukitel
Eesti Pank: koroonaviiruse levik tõmbab Eesti turismiteenuste hindadele pidurit	https://majandus24.postimees.ee/6916194/eesti-pank-koroonaviiruse-levik-tombab-eesti-turismiteenuste-hindadele-pidurit
Nafta hind kukub, autokütuste hinnad on paigal	https://majandus24.postimees.ee/6916138/nafta-hind-kukub-autokutuste-hinnad-on-paigal
Hinnad pöördusid tõusule	https://majandus24.postimees.ee/6916088/hinnad-poordusid-tousule
Venemaa tühistas viiruspuhangu tõttu tähtsa majandusfoorumi	https://majandus24.postimees.ee/6916039/venemaa-tuhistas-viiruspuhangu-tottu-tahtsa-majandusfoorumi
Aasta majanduskonverents «Uus majandusmudel»	https://majandus24.postimees.ee/6915351/aasta-majanduskonverents-uus-majandusmudel
Hiigelreform sikutaks töötud vaesusest välja	https://majandus24.postimees.ee/6915823/hiigelreform-sikutaks-tootud-vaesusest-valja
Lego viirus ei hirmuta	https://majandus24.postimees.ee/6915789/lego-viirus-ei-hirmuta
Eesti on Baltimaadest investorite lemmik	https://majandus24.postimees.ee/6915673/eesti-on-baltimaadest-investorite-lemmik
Pankadevahelised kiirmaksed võtsid idufirmalt töö	https://majandus24.postimees.ee/6915285/pankadevahelised-kiirmaksed-votsid-idufirmalt-too
Eesti Pank valmis andma hiigelsuurt laenu	https://majandus24.postimees.ee/6915641/eesti-pank-valmis-andma-hiigelsuurt-laenu
Euroliidu ja brittide kaubakõnelused umbsõlmes	https://majandus24.postimees.ee/6915658/euroliidu-ja-brittide-kaubakonelused-umbsolmes
Uute sõiduatode müük pöördus Eestis langusesse	https://majandus24.postimees.ee/6915632/uute-soiduatode-muuk-poordus-eestis-langusesse
Kindlustus: läinud aasta tõi ligi 40 protsenti rohkem tormikahjusid	https://heureka.postimees.ee/6915602/kindlustus-lainud-aasta-toi-ligi-40-protsenti-rohkem-tormikahjusid
Kadi Lambot napsas Telia tippjuhi	https://majandus24.postimees.ee/6915496/kadi-lambot-napsas-telia-tippjuhi
Rocca al Mare ja Kristiine keskuse ootamatu juhivahetus	https://majandus24.postimees.ee/6915473/rocca-al-mare-ja-kristiine-keskuse-ootamatu-juhivahetus
Helme lõi kriisikomisjoni	https://majandus24.postimees.ee/6915421/helme-loi-kriisikomisjoni
